{
  "brief_hash": "f1ba346d",
  "group": "f1ba346d",
  "created_at": "2026-07-06T14:26:37+09:00",
  "brief": {
    "requirement": "task1/refund_design.md의 환불 정책을 실행 가능한 테스트 초안으로 고정한다. 범위는 환불 금액 산출(PRORATION, MANUAL, 7일 이하 무료), 환불 가능 여부 검증, 환불 유형 결정, 주문/환불 상태 전이이며 결제 취소 외부 의존은 Mock 대상으로 둔다.",
    "source_material": "# 환불 정책 도메인 설계\n\n> 실업무 기반: DoDo Class 구독 결제 서비스의 환불 로직을 Java 도메인으로 재설계한다.\n> 이 문서는 코드 작성 전 설계 기준이며, A-3 단위테스트와 A-4 Gherkin의 근거가 된다.\n\n---\n\n## 1. 도메인 개념\n\n### 핵심 개념\n\n| 개념 | 설명 |\n|------|------|\n| Order (주문) | 결제가 완료된 구독 주문. 환불의 대상이 된다. |\n| Refund (환불) | 주문에 대한 환불 요청 및 그 결과. |\n| RefundPolicy (환불 정책) | 환불 금액을 어떻게 산출할지 결정하는 규칙. |\n| CancellableAmount (환불 가능 금액) | `주문금액 - 이미 환불된 금액`. 이 금액을 초과해서 환불할 수 없다. |\n\n### 이번 scope\n\n- 환불 금액 산출 (일할 계산, 수동 지정, 7일 이하 무료)\n- 환불 후 주문 상태 전이\n- 환불 엔티티 상태 전이\n- 결제 취소(외부 의존), DB, 구독 취소는 scope 밖 (→ Mock 대상)\n\n---\n\n## 2. 도메인 흐름 (순서 다이어그램)\n\n> 인프라(Client / API 서버 / PG 세부)가 아니라 **도메인 개념 간의 상호작용**만 표현한다.\n> 외부 결제 취소는 하나의 \"외부 의존\"으로만 추상화한다.\n\n### 2-1. 환불 처리 흐름 (Happy Path)\n\n```mermaid\nsequenceDiagram\n    participant 요청 as 환불 요청\n    participant 주문 as 주문(Order)\n    participant 계산 as 환불 금액 산출\n    participant 환불 as 환불(Refund)\n    participant 외부 as 결제 취소(외부 의존)\n\n    요청->>주문: 환불 가능 여부 검증\n    Note right of 주문: PAID / PARTIALLY_REFUNDED 만 허용\n    주문-->>요청: OK (환불 가능 금액 확인)\n\n    요청->>계산: 정책에 따라 환불 금액 산출\n    Note right of 계산: PRORATION / MANUAL / 7일 이하 무료\n    계산-->>요청: 환불 금액\n\n    요청->>환불: 환불 생성 (REQUESTED)\n\n    요청->>외부: 결제 취소 요청\n    외부-->>요청: 취소 결과\n\n    요청->>환불: 성공 처리 (SUCCEEDED)\n    요청->>주문: 환불 적용 → 상태 전이\n    Note right of 주문: 전액 → REFUNDED<br/>부분 → PARTIALLY_REFUNDED\n```\n\n### 2-2. 결제 취소 결과에 따른 분기\n\n```mermaid\nsequenceDiagram\n    participant 요청 as 환불 요청\n    participant 외부 as 결제 취소(외부 의존)\n    participant 환불 as 환불(Refund)\n\n    요청->>외부: 결제 취소 요청\n\n    alt 명확한 거부 (잔액 부족 등)\n        외부-->>요청: 실패\n        요청->>환불: 실패 처리 (FAILED)\n    else 결과 불확실 (네트워크 오류 등)\n        외부-->>요청: 응답 불확실\n        요청->>환불: 타임아웃 처리 (TIMED_OUT)\n        Note over 환불: 관리자 수동 처리 필요\n    end\n```\n\n> **task1 단위테스트 범위**: 결제 취소(외부 의존)를 제외한 부분 —\n> 주문 환불 가능 검증 · 환불 금액 산출 · 환불/주문 상태 전이. (외부 없이 실행 가능)\n\n---\n\n## 3. 상태 다이어그램\n\n### 3-1. 주문(Order) 상태\n\n```\n[PAID] ──────────────────────────────▶ [REFUNDED]\n  │          (환불금액 == 전체금액)\n  │\n  └──────────────────────────────────▶ [PARTIALLY_REFUNDED]\n               (환불금액 < 전체금액)\n                    │\n                    └────────────────▶ [REFUNDED]\n                         (추가 환불로 전액 도달)\n```\n\n- 환불 가능한 초기 상태: `PAID`, `PARTIALLY_REFUNDED`\n- `REFUNDED` 상태에서는 추가 환불 불가\n- `PENDING`, `FAILED` 상태에서는 환불 불가\n\n### 3-2. 환불(Refund) 상태\n\n```\n              [REQUESTED]\n             /     |     \\\n            /      |      \\\n     [SUCCEEDED] [FAILED] [TIMED_OUT]\n```\n\n- `REQUESTED`: 환불 요청이 생성된 상태. 결제 취소 전.\n- `SUCCEEDED`: 결제 취소 성공.\n- `FAILED`: 결제 취소가 명확히 거부됨 (잔액 부족 등).\n- `TIMED_OUT`: 네트워크 오류 등 결과 불확실. 관리자 수동 처리 필요.\n\n---\n\n## 4. 환불 정책 (RefundPolicy)\n\n### 4-1. PRORATION (일할 계산)\n\n구독 기간 중 사용하지 않은 일수에 비례하여 환불한다.\n\n```\n일할 단가  = 결제금액 / 총 구독 일수\n환불금액   = 일할 단가 × 잔여 일수\n\n단, 잔여 일수 == 총 일수 (당일 환불) → 전액 환불\n단, 잔여 일수 == 0 → 환불금액 0원\n```\n\n**예시**\n\n| 결제금액 | 총 일수 | 잔여 일수 | 일할 단가 | 환불금액 |\n|---------|--------|---------|---------|--------|\n| 30,000원 | 30일 | 15일 | 1,000원 | 15,000원 |\n| 30,000원 | 30일 | 30일 | 1,000원 | 30,000원 (전액) |\n| 30,000원 | 30일 | 0일  | 1,000원 | 0원 |\n| 10,000원 | 30일 | 7일  | 333원   | 2,331원 (절사) |\n\n> 소수점 이하는 절사(floor). 단가 = price / totalDays (정수 나눗셈).\n\n### 4-2. MANUAL (수동 지정)\n\n관리자가 환불 금액을 직접 지정한다. **모든 규칙보다 우선한다** — MANUAL이 지정되면 7일 무료·일할 계산과 무관하게 지정 금액을 따른다.\n\n```\n환불금액 = 지정금액\n단, 지정금액 > 환불 가능 금액 → 오류\n단, 지정금액 <= 0 → 오류\n```\n\n### 4-3. 7일 이하 무료 (청약 철회)\n\n결제일로부터 경과일이 7일 이하이면 전액 환불한다 (위약금 없음). 단, MANUAL 지정이 없을 때만 적용된다.\n\n```\n경과일 <= 7  → 전액 환불 (무료)\n경과일 >= 8  → PRORATION 적용\n```\n\n- 전자상거래법상 청약철회 기간에 대응한다.\n- PRORATION보다 우선하지만, **MANUAL보다는 후순위**다.\n- 경과일 기준: 결제 시각의 날짜 기준 (UTC, 시/분/초 제거).\n\n### 4-4. 정책 우선순위\n\n환불 금액 산출 시 아래 순서로 판정한다.\n\n```\n1. MANUAL 지정이 있으면      → 지정 금액 (최우선)\n2. 경과일 <= 7 이면          → 전액 환불 (무료)\n3. 그 외                     → PRORATION 일할 계산\n```\n\n---\n\n## 5. 환불 유형 결정\n\n환불 금액이 확정된 후 환불 유형을 결정한다.\n\n```\n환불금액 == 환불 가능 금액 → FULL\n환불금액 <  환불 가능 금액 → PARTIAL\n```\n\n---\n\n## 6. 경계값 및 예외 케이스\n\n### 6-1. 일할 계산 경계값\n\n| 케이스 | 입력 | 기대 결과 |\n|--------|------|----------|\n| 당일 환불 | remainingDays == totalDays | 전액 환불 |\n| 마지막 날 환불 | remainingDays == 1 | 일할 단가 × 1 |\n| 만료 후 환불 | remainingDays == 0 | 환불금액 0 |\n| 소수점 절사 | 10,000원 / 30일 × 7일 | 2,331원 |\n| totalDays <= 0 | 잘못된 구독 기간 | 예외 발생 |\n\n### 6-2. 7일 이하 무료 경계값\n\n| 케이스 | 조건 | 기대 결과 |\n|--------|------|----------|\n| 당일 환불 | 경과일 0일 | 전액 환불 |\n| 무료 경계 | 경과일 7일 | 전액 환불 |\n| 무료 종료 직후 | 경과일 8일 | 선택 정책 적용 |\n\n### 6-3. 환불 가능 여부 경계값\n\n| 케이스 | 조건 | 기대 결과 |\n|--------|------|----------|\n| 정상 환불 | 주문 PAID, 환불금액 <= cancellableAmount | 성공 |\n| 이미 전액 환불 | 주문 REFUNDED | 환불 불가 예외 |\n| 결제 안 된 주문 | 주문 PENDING / FAILED | 환불 불가 예외 |\n| 환불금액 초과 | 환불금액 > cancellableAmount | 예외 발생 |\n| 수동 금액 0 이하 | manualAmount <= 0 | 예외 발생 |\n| 부분 환불 후 전액 도달 | canceledAmount + refundAmount == amount | REFUNDED 전이 |\n| 부분 환불 후 미도달 | canceledAmount + refundAmount < amount | PARTIALLY_REFUNDED 유지 |\n\n### 6-4. 주문 상태 전이 경계값\n\n| 환불 전 주문 상태 | 환불 후 상태 | 조건 |\n|-----------------|-------------|------|\n| PAID | REFUNDED | 전액 환불 |\n| PAID | PARTIALLY_REFUNDED | 부분 환불 |\n| PARTIALLY_REFUNDED | REFUNDED | 추가 환불로 전액 도달 |\n| PARTIALLY_REFUNDED | PARTIALLY_REFUNDED | 추가 환불, 아직 잔액 있음 |\n\n---\n\n## 8. 의사결정 기록\n\n### 결정 사항\n\n- 소수점 절사 기준: **floor(절사)** — 실서비스 기준.\n- 잔여일/경과일 계산 기준: 결제·환불 요청 시각의 **UTC 날짜**로 계산 (시/분/초 제거).\n- MANUAL 정책 0원 환불: **불허** (0 이하 예외).\n- 부분 환불 후 환불 가능 금액: `amount - canceledAmount`로 재계산.\n- 정책 우선순위: **MANUAL > 7일 이하 무료 > PRORATION**.\n- 동시성: 환불 요청 시 **Order 비관적 락**, 상태 변경 시 **REQUESTED 낙관적 락**.\n\n### 미결 사항\n\n- 현재 없음.",
    "title": "환불 정책 도메인 설계",
    "policy_rules": [
      "MANUAL > 7일 이하 무료 > PRORATION",
      "환불 가능 금액 = 주문금액 - 이미 환불된 금액이며 이를 초과할 수 없다",
      "소수점 이하는 floor 절사하고 일수 계산은 UTC 날짜 기준으로 한다",
      "환불 가능한 주문 상태는 PAID/PARTIALLY_REFUNDED이며 REFUNDED/PENDING/FAILED는 불가하다",
      "Refund는 REQUESTED에서 SUCCEEDED/FAILED/TIMED_OUT으로 전이한다"
    ],
    "external_dependencies": [
      "결제 취소(PG)",
      "DB",
      "구독 취소"
    ]
  }
}
